{
  "gate_protocol_id": "runtime-modern-gates-v0.1",
  "version": "0.1.0",
  "runtime_snapshot_id": "runtime-modern-v1-2026-07-20",
  "action_policy": {
    "name": "uniform_legal_action",
    "rng": "numpy_pcg64"
  },
  "visibility_codes": {
    "padding": 0,
    "hidden_private": 1,
    "owner_visible": 2,
    "public_field": 3,
    "confirmed_reveal": 4,
    "selectable_own_deck": 5,
    "opponent_facedown": 6
  },
  "gates": {
    "step": {
      "result_stem": "step",
      "action_index": 0
    },
    "hidden_information": {
      "result_stem": "hidden_information",
      "action_seed_offset": 310000,
      "max_steps": 2000,
      "minimum_steps_audited": 100,
      "minimum_private_rows": 100,
      "minimum_confirmed_reveal_rows": 1
    },
    "trace_replay": {
      "result_stem": "trace_replay",
      "action_seed_offset": 320000,
      "max_steps": 400
    },
    "lifecycle": {
      "result_stem": "lifecycle_100",
      "completed_cycles_target": 100
    },
    "throughput": {
      "result_stem": "throughput",
      "action_seed_offset": 330000,
      "environment_overrides": {
        "num_envs": 16,
        "batch_size": 16,
        "num_threads": 16
      },
      "warmup_steps": 512,
      "measured_steps": 8192,
      "minimum_steps_per_second": 1000
    },
    "random_eval": {
      "result_stem": "random_eval_32",
      "action_seed_offset": 340000,
      "episodes": 32,
      "max_steps_per_episode": 10000
    }
  }
}
